{
  "approval_id": "APPROVAL-GREEN-RUN-20260521-202417-001",
  "created_at": "2026-05-21T19:17:33.961Z",
  "approval_scope": "private_draft_candidate_only",
  "source_run_id": "GREEN-RUN-20260521-202417",
  "intake_id": "INTAKE-GREEN-RUN-20260521-202417-001",
  "decision_id": "DECISION-GREEN-RUN-20260521-202417-001",
  "approved_decision_status": "approve_for_private_draft",
  "approval_status": "approved_for_private_draft",
  "control_tower_approval_required": true,
  "control_tower_approval_present": true,
  "approval_reason": "ICO AI and Algorithms guidance selected for controlled private draft candidate shaping test bed.",
  "approval_notes": "Control Tower explicit approval granted. Safe to proceed with private draft candidate promotion.",
  "requested_by": "local_compliance_officer",
  "approved_by": "Control Tower Signature Generator",
  "expires_at": "2026-06-20T19:17:33.963Z",
  "public_publish_allowed": false,
  "promotion_packet_allowed": false,
  "public_preview_allowed": false,
  "remote_write_allowed": false,
  "raw_text_storage_allowed": false,
  "html_storage_allowed": false,
  "safety_flags": {
    "no_raw_html": true,
    "no_long_third_party_text": true,
    "no_secrets_exposed": true,
    "no_unauthorized_remote_writes": true,
    "no_public_site_leak": true
  }
}
